<?xml version='1.0' encoding='UTF-8' ?>
<!DOCTYPE dataset SYSTEM "..\dtd\Opale.dtd">

<dataset>
	<keygen />
	<draft />
	<draft id="1" reference="REF-DRAFT-1" codePartenaire="000111"
		timestamp="[now]" />
	<draft id="2" reference="REF-DRAFT-3" codePartenaire="000111"
		timestamp="[now]" />

	<draft id="3" reference="REF-DRAFT-4" codePartenaire="000111"
		timestamp="[now]" />
	<draftLigne />
	<draftLigne id="1000" reference="00000001" referenceTarif="mensuel_jet10_base"
		referenceOffre="jet_surf10" qui="GRC.WEL-JOHNDOE"
		canal="Welcome" ip="127.0.0.1" timestamp="[now]" draftId="1" geste="VENTE"/>

	<draftLigne id="1001" reference="00000002" referenceTarif="mensuel_jet10_base"
		referenceOffre="jet_surf100" qui="GRC.WEL-JOHNDOE"
		canal="Welcome" ip="127.0.0.1" timestamp="[now]" draftId="2" geste="VENTE"/>

	<draftLigne id="1002" reference="00000003" referenceTarif="mensuel_jet10_base"
		referenceOffre="jet_surf10" qui="GRC.WEL-JOHNDOE"
		canal="Welcome" ip="127.0.0.1" timestamp="[now]" draftId="3" geste="VENTE"/>

	<draftLigneDetail />
	<draftLigneDetail id="1000" referenceSelection="kitsat"
		referenceChoix="trafic10g" referenceTarif="mensuel_jet10_base"
		configurationJson="" draftLigneId="1000" />
	<draftLigneDetail id="1001" referenceSelection="jet"
		referenceChoix="trafic10g" referenceTarif="mensuel_jet10_base"
		configurationJson="" draftLigneId="1000" dependDe="1000" />

	<draftLigneDetail id="1002" referenceSelection="kitsat"
		referenceChoix="trafic10g" referenceTarif="mensuel_jet10_base"
		configurationJson="" draftLigneId="1001" />
	<draftLigneDetail id="1003" referenceSelection="jet"
		referenceChoix="trafic10g" referenceTarif="mensuel_jet10_base"
		configurationJson="" draftLigneId="1001" dependDe="1000" />

	<draftLigneDetail id="1004" referenceSelection="kitsat10"
		referenceChoix="trafic10g" referenceTarif="mensuel_jet10_base"
		configurationJson="" draftLigneId="1002" />

	<reduction id="1005" label="reduction sur ligne"
		nbUtilisationMax="5" reference="00000001" referenceDraft="REF-DRAFT-1"
		typeValeur="POURCENTAGE" valeur="50" />
	<reduction id="1000" label="reduction sur ligne"
		nbUtilisationMax="5" reference="00000002" referenceDraft="REF-DRAFT-1"
		referenceLigne="00000001" typeValeur="POURCENTAGE" valeur="50" />
	<reduction id="1001" label="reduction sur produit"
		nbUtilisationMax="5" reference="00000003" referenceDraft="REF-DRAFT-1"
		referenceLigne="00000001" referenceLigneDetail="trafic10g" typeValeur="POURCENTAGE"
		valeur="50" />
	<reduction id="1002" label="reduction sur produit parent"
		nbUtilisationMax="5" reference="00000004" referenceDraft="REF-DRAFT-1"
		referenceLigne="00000001" referenceTarif="annuel_jet10_base"
		typeValeur="POURCENTAGE" valeur="50" />
	<reduction id="1003" label="reduction sur frais ligne"
		nbUtilisationMax="5" reference="00000005" referenceDraft="REF-DRAFT-1"
		referenceLigne="00000001" referenceFrais="engagement_kitsat"
		referenceTarif="annuel_jet10_base" typeValeur="POURCENTAGE" valeur="50" />
	<reduction id="1004" label="reduction sur frais detail"
		nbUtilisationMax="5" reference="00000006" referenceDraft="REF-DRAFT-1"
		referenceLigne="00000001" referenceFrais="std_Cloture"
		referenceLigneDetail="trafic10g" referenceTarif="mensuel_jet10_base"
		typeValeur="POURCENTAGE" valeur="50" />

</dataset>