<?xml version='1.0' encoding='UTF-8' ?>
<!DOCTYPE dataset SYSTEM "..\dtd\Opale.dtd">

<dataset>
<draft id="1000" canal="welcome" codePartenaire="PART_CODE" ip="127.0.0.1" qui="GRC.WEL-JOHNDOE" timestamp="[now]" reference="Dra-00000001" geste="VENTE" />
<draft id="1001" canal="welcome" codePartenaire="PART_CODE" ip="127.0.0.1" qui="GRC.WEL-JOHNDOE" timestamp="[now]" reference="Dra-00000002" geste="VENTE" />

<draftLigne id="1000" canal="welcome" ip="127.0.0.1" qui="GRC.WEL-JOHNDOE" timestamp="[now]" reference="00000001" referenceOffre="jet_surf10" referenceTarif="annuel_jet10_base" draftId="1000" />
<draftLigne id="1001" canal="welcome" ip="127.0.0.1" qui="GRC.WEL-JOHNDOE" timestamp="[now]" reference="00000001" referenceOffre="jet_surf10" referenceTarif="annuel_jet10_base" draftId="1001" />

<draftLigneDetail id="1000" referenceChoix="kitsat" referenceSelection="kitsat" referenceTarif="mensuel_jet10_base" draftLigneId="1000" />
<draftLigneDetail id="1001" referenceChoix="jet" referenceSelection="jet" referenceTarif="mensuel_jet10_base" dependDe="1000" draftLigneId="1000" />
<draftLigneDetail id="1002" referenceChoix="jet" referenceSelection="kitsat" referenceTarif="mensuel_jet10_base" draftLigneId="1001" />
<draftLigneDetail id="1003" referenceChoix="kitsat" referenceSelection="kitTlf" referenceTarif="mensuel_jet10_base" dependDe="1002" draftLigneId="1001" />

<tarif id="1000" duree="5" engagement="12" frequence="5" prix="34.9" reference="annuel_jet10_base" typeTVA="S" />
<tarif id="1001" duree="12" engagement="12" frequence="5" prix="34.9" reference="annuel_jet10_base" typeTVA="S" />
<tarif id="1002" duree="12" engagement="12" frequence="6" prix="34.9" reference="annuel_jet10_base" typeTVA="S" />

<reduction id="1000" reference="reduc-draft" referenceDraft="Dra-00000001" typeValeur="POURCENTAGE" valeur="10"/>
<reduction id="1001" reference="reduc-ligne" referenceDraft="Dra-00000001" referenceLigne="00000001" typeValeur="POURCENTAGE" valeur="10"/>
<reduction id="1002" reference="reduc-ligne-detail-kitsat" referenceDraft="Dra-00000001" referenceLigne="00000001" referenceLigneDetail="kitsat" typeValeur="POURCENTAGE" valeur="10"/>
<reduction id="1003" reference="reduc-ligne-detail-jet" referenceDraft="Dra-00000001" referenceLigne="00000001" referenceLigneDetail="jet" typeValeur="POURCENTAGE" valeur="10"/>
<reduction id="1004" reference="reduc-ligne-frais" referenceDraft="Dra-00000001" referenceLigne="00000001"  referenceTarif="annuel_jet10_base"  referenceFrais="engagement_kitsat" typeValeur="POURCENTAGE" valeur="10"/>
<reduction id="1005" reference="reduc-ligne-detail-jet-frais" referenceDraft="Dra-00000001" referenceLigne="00000001" referenceLigneDetail="jet"  referenceTarif="mensuel_jet10_base"  referenceFrais="engagement_kitsat" typeValeur="POURCENTAGE" valeur="10"/>
<reduction id="1006" reference="reduc-ligne-detail-kitsat-frais" referenceDraft="Dra-00000001" referenceLigne="00000001" referenceLigneDetail="kitsat"  referenceTarif="mensuel_jet10_base"  referenceFrais="engagement_kitsat" typeValeur="POURCENTAGE" valeur="10"/>

</dataset>