<?xml version='1.0' encoding='UTF-8' ?>
<!DOCTYPE dataset SYSTEM "./src/test/resources/dtd/opale.dtd">

<dataset>
<draft id="1" reference="REF-DRAFT-1"   codePartenaire="000111" ts="[now]" canal="welcome" qui="someone" annulerCommandeSource="false"/>
<draft id="2" reference="REF-DRAFT-2"   codePartenaire="000222" ts="[now]" canal="welcome" qui="someone" annulerCommandeSource="false"/>
<draft id="3" reference="REF-DRAFT-3"   codePartenaire="000222" ts="[now]" canal="welcome" qui="someone" annulerCommandeSource="false"/>

<draftLigne id="3" reference="REF-LIGNE-1" canal="welcome" ip="127.0.0.1" qui="GRC.WEL-JOHNDOE" ts="[now]" referenceOffre="jet_surf10" referenceTarif="annuel_jet10_base" draftId="1" />
<draftLigne id="4" reference="REF-LIGNE-2" canal="welcome" ip="127.0.0.1" qui="GRC.WEL-JOHNDOE" ts="[now]" referenceOffre="jet_surf10"  draftId="1" />

<draftLigneDetail id="5" referenceChoix="kitsat" referenceSelection="kitsat" referenceTarif="mensuel_jet10_base" draftLigneId="3" />
<draftLigneDetail id="6" referenceChoix="jet" referenceSelection="jet"  dependDe="5" draftLigneId="3" />

<reduction id="7" reference="reduc-draft" referenceDraft="REF-DRAFT-3" typeValeur="POURCENTAGE" valeur="10"/>

</dataset>