<?xml version='1.0' encoding='UTF-8' ?>
<!DOCTYPE dataset SYSTEM "..\dtd\Opale.dtd">
<dataset>
<commande id="1000" canal="welcome"  ip="GRC.WEL-JOHNDOE" timestamp="[now]" reference="00000001" referenceDraft="00000001" />
<commande id="1001" canal="welcome"  ip="GRC.WEL-JOHNDOE" timestamp="[now]" reference="00000002" referenceDraft="00000002" />
<commande id="1002" canal="welcome"  ip="GRC.WEL-JOHNDOE" timestamp="[now]" reference="00000003" referenceDraft="00000003" />

<commandeLigne id="1000" gamme="jet" modeFacturation="PREMIER_MOIS" referenceOffre="jet_surf10" commandeId="1000" secteur="sat" tarifId="1002" />
<commandeLigne id="1001" gamme="jet" modeFacturation="PREMIER_MOIS" referenceOffre="jet_surf10" commandeId="1001" secteur="sat" tarifId="1006" />
<commandeLigne id="1002" gamme="jet" modeFacturation="PREMIER_MOIS" referenceOffre="jet_surf10" commandeId="1002" secteur="sat" tarifId="1007" />

<commandeLigneDetail id="1000" referenceChoix="jet" label="Trafic 10 Gigas" typeProduit="SERVICE" dependDe="1001" commandeLigneId="1000" tarifId="1000" />
<commandeLigneDetail id="1001" referenceChoix="kitsat" label="Trafic 10 Gigas" typeProduit="BIEN" commandeLigneId="1000" tarifId="1001" />
<commandeLigneDetail id="1002" referenceChoix="jet" label="Trafic 10 Gigas" typeProduit="SERVICE" dependDe="1003" commandeLigneId="1001" tarifId="1004" />
<commandeLigneDetail id="1003" referenceChoix="kitsat" label="Trafic 10 Gigas" typeProduit="BIEN" commandeLigneId="1001" tarifId="1005" />
<commandeLigneDetail id="1004" referenceChoix="jet" label="Trafic 10 Gigas" typeProduit="SERVICE" dependDe="1003" commandeLigneId="1002" tarifId="1008" />
<commandeLigneDetail id="1005" referenceChoix="kitsat" label="Trafic 10 Gigas" typeProduit="BIEN" commandeLigneId="1002" tarifId="1009" />

<tarif id="1000" duree="5" engagement="12" frequence="5" prix="34.9" reference="annuel_jet10_base" typeTVA="S" />
<tarif id="1001" duree="12" engagement="12" frequence="12" prix="34.9" reference="annuel_jet10_base" typeTVA="S" />
<tarif id="1002" duree="12" engagement="12" frequence="12" prix="34.9" reference="annuel_jet10_base" typeTVA="S" />
<tarif id="1004" duree="5" engagement="12" frequence="5" prix="34.9" reference="annuel_jet10_base" typeTVA="S" />
<tarif id="1005" duree="12" engagement="12" frequence="6" prix="34.9" reference="annuel_jet10_base" typeTVA="S" />
<tarif id="1006" duree="12" engagement="12" frequence="5" prix="34.9" reference="annuel_jet10_base" typeTVA="S" />
<tarif id="1007" duree="5" engagement="12" frequence="5" prix="34.9" reference="annuel_jet10_base" typeTVA="S" />
<tarif id="1008" duree="12" engagement="12" frequence="6" prix="34.9" reference="annuel_jet10_base" typeTVA="S" />
<tarif id="1009" duree="12" engagement="12" frequence="5" prix="34.9" reference="annuel_jet10_base" typeTVA="S" />

<frais id="1000" montant="50" typeFrais="CREATION" tarifId="1000" />
<frais id="1001" montant="50" typeFrais="RESILIATION" tarifId="1001" />
<frais id="1002" montant="50" typeFrais="RESILIATION" tarifId="1002" />
<frais id="1004" montant="50" typeFrais="RESILIATION" tarifId="1004" />
<frais id="1005" montant="50" typeFrais="CREATION" tarifId="1005" />
<frais id="1006" montant="50" typeFrais="RESILIATION" tarifId="1006" />
<frais id="1007" montant="50" typeFrais="RESILIATION" tarifId="1007" />
<frais id="1008" montant="50" typeFrais="CREATION" tarifId="1008" />
<frais id="1009" montant="50" typeFrais="RESILIATION" tarifId="1009" />

<paiement id="1000" montant="90" modePaiement="CB" reference="00000001" referenceCommande="00000001" typePaiement="COMPTANT" canal="welcome" ip="127.0.0.1" qui="GRC.WEL-JOHNDOE" timestamp="[now]" timestampIntention="[now]" timestampPaiement="[now]"  />
<paiement id="1001" montant="90" modePaiement="CB" reference="00000001" referenceCommande="00000003" typePaiement="RECURRENT" canal="welcome" ip="127.0.0.1" qui="GRC.WEL-JOHNDOE" timestamp="[now]" timestampPaiement="[now]"  />
</dataset>