<?xml version='1.0' encoding='UTF-8' ?>
<!DOCTYPE dataset SYSTEM "..\dtd\Opale.dtd">

<dataset>

<draft/>
<draft id="1000" canal="welcome" codePartenaire="PART_CODE" ip="127.0.0.1" qui="GRC.WEL-JOHNDOE" ts="[now]" reference="Dra-00000001"  />
<draft id="1001" canal="welcome" codePartenaire="PART_CODE" ip="127.0.0.1" qui="GRC.WEL-JOHNDOE" ts="[now]" reference="Dra-00000002"  />

<draftLigne/>
<draftLigne id="1000" canal="welcome" ip="127.0.0.1" qui="GRC.WEL-JOHNDOE" ts="[now]" reference="00000001" referenceOffre="avfwpro-confort-s" referenceTarif="avfw.essentiel.3mois" draftId="1000" />
<draftLigne id="1001" canal="welcome" ip="127.0.0.1" qui="GRC.WEL-JOHNDOE" ts="[now]" reference="00000001" referenceOffre="jet_surf10" referenceTarif="annuel_jet10_base" draftId="1001" />

<draftLigneDetail/>

<reduction/>
<reduction id="1000" reference="reduc-draft" referenceDraft="Dra-00000001" typeValeur="POURCENTAGE" valeur="10"/>
<reduction id="1001" reference="reduc-ligne" referenceDraft="Dra-00000001" referenceLigne="00000001" typeValeur="POURCENTAGE" valeur="10"/>
<reduction id="1003" reference="reduc-ligne-tarif" referenceDraft="Dra-00000001" referenceLigne="00000001" referenceTarif="avfw.essentiel.3mois" typeValeur="POURCENTAGE" valeur="10"/>
<reduction id="1004" reference="reduc-ligne-frais" referenceDraft="Dra-00000001" referenceLigne="00000001"  referenceTarif="avfw.essentiel.3mois"  referenceFrais="engagement_kitsat" typeValeur="POURCENTAGE" valeur="10"/>

</dataset>