<?xml version='1.0' encoding='UTF-8' ?>
<!DOCTYPE dataset SYSTEM ".\src\test\resources\dtd\opale.dtd">
<dataset>
<commande/>
<commande id="1000" canal="welcome"  ip="GRC.WEL-JOHNDOE" ts="[now]" reference="REF-COMMANDE-1" referenceDraft="00000001" />
<commandeLigne/>
<commandeLigne id="1000" gamme="jet" modeFacturation="PREMIER_MOIS" referenceOffre="jet_surf10" commandeId="1000" secteur="sat" tarifId="1000"/>
<commandeLigneDetail/>
<tarif/>
<tarif id="1000" duree="12" engagement="12" frequence="12" prix="34.9" reference="annuel_jet10_base" typeTVA="S" />
<frais/>
</dataset>