<?xml version='1.0' encoding='UTF-8' ?>
<!DOCTYPE dataset SYSTEM "..\dtd\Opale.dtd">

<dataset>
<client id="1000" adresseId="address-id" canal="welcome" clientId="client-id" timestamp="[now]" ip="1.1.1.1" qui="welcome" tva="00" />

<draft id="1000" canal="welcome" codePartenaire="PART_CODE" ip="127.0.0.1" qui="GRC.WEL-JOHNDOE" timestamp="[now]" reference="Dra-00000001"  />
<draft id="1001" canal="welcome" codePartenaire="PART_CODE" ip="127.0.0.1" qui="GRC.WEL-JOHNDOE" timestamp="[now]" reference="Dra-00000002"  />
<draft id="1002" canal="welcome" codePartenaire="PART_CODE" ip="127.0.0.1" qui="GRC.WEL-JOHNDOE" timestamp="[now]" reference="Dra-00000003" clientAFacturerId="1000" />

<draftLigne id="1000" canal="welcome" ip="127.0.0.1" qui="GRC.WEL-JOHNDOE" timestamp="[now]" reference="00000001" referenceOffre="jet_surf10" referenceTarif="annuel_jet10_base" draftId="1000" />
<draftLigne id="1001" canal="welcome" ip="127.0.0.1" qui="GRC.WEL-JOHNDOE" timestamp="[now]" reference="00000002" referenceOffre="jet_surf10" referenceTarif="annuel_jet10_base" draftId="1001" />
<draftLigne id="1002" canal="welcome" ip="127.0.0.1" qui="GRC.WEL-JOHNDOE" timestamp="[now]" reference="00000003" referenceOffre="jet_surf10" referenceTarif="annuel_jet10_base" draftId="1002" />

<draftLigneDetail id="1000" referenceChoix="kitsat" referenceSelection="kitsat" referenceTarif="mensuel_jet10_base" draftLigneId="1000" />
<draftLigneDetail id="1001" referenceChoix="jet" referenceSelection="jet" referenceTarif="mensuel_jet10_base" dependDe="1000" draftLigneId="1000" />
<draftLigneDetail id="1002" referenceChoix="trafic10g" referenceSelection="kitsat" referenceTarif="mensuel_jet10_base" draftLigneId="1001" />
<draftLigneDetail id="1003" referenceChoix="trafic10g" referenceSelection="kitTlf" referenceTarif="mensuel_jet10_base" dependDe="1002" draftLigneId="1001" />
<draftLigneDetail id="1004" referenceChoix="kitsat" referenceSelection="kitsat" referenceTarif="mensuel_jet10_base" draftLigneId="1002" />
<draftLigneDetail id="1005" referenceChoix="jet" referenceSelection="jet" referenceTarif="mensuel_jet10_base" dependDe="1004" draftLigneId="1002" />

<tarif id="1000" duree="5" engagement="12" frequence="5" prix="34.9" reference="annuel_jet10_base" typeTVA="S" />
<tarif id="1001" duree="12" engagement="12" frequence="5" prix="34.9" reference="annuel_jet10_base" typeTVA="S" />
<tarif id="1002" duree="12" engagement="12" frequence="6" prix="34.9" reference="annuel_jet10_base" typeTVA="S" />

</dataset>