<?xml version='1.0' encoding='UTF-8' ?>
<!DOCTYPE dataset SYSTEM "..\dtd\Opale.dtd">
<dataset>
<client id="1000" adresseId="adr-fac" clientId="cl-fac"  qui="someone" timestamp="[now]"/>
<client id="1001" adresseId="adr-sousc" clientId="cl-sousc"   qui="someone" timestamp="[now]"/>
<client id="1002" adresseId="adr-liv" clientId="cl-livc"   qui="someone" timestamp="[now]"/>

<commande id="1000" canal="welcome" codePartenaire="part_123456" ip="GRC.WEL-JOHNDOE" timestamp="[now]" reference="00000001" referenceDraft="00000001" clientAFacturerId="1000" clientSouscripteurId="1001" clientALivrerId="1002" />

<commandeLigne id="1000" canal="welcome"  ip="GRC.WEL-JOHNDOE" timestamp="[now]" gamme="jet" modeFacturation="PREMIER_MOIS" referenceOffre="jet_surf10" commandeId="1000" famille="sat" tarifId="1002" />

<commandeLigneDetail id="1000" referenceChoix="jet" label="Trafic 10 Gigas" typeProduit="SERVICE" dependDe="1001" commandeLigneId="1000" tarifId="1000" />
<commandeLigneDetail id="1001" referenceChoix="kitsat" label="Trafic 10 Gigas" typeProduit="BIEN" commandeLigneId="1000" tarifId="1001" />

<tarif id="1000" duree="5" engagement="12" frequence="5" prix="34.9" reference="annuel_jet10_base" typeTVA="S" />
<tarif id="1001" duree="12" engagement="12" frequence="5" prix="34.9" reference="annuel_jet10_base" typeTVA="S" />
<tarif id="1002" duree="12" engagement="12" frequence="6" prix="34.9" reference="annuel_jet10_base" typeTVA="S" />

<frais id="1000" montant="50" typeTVA="S" typeFrais="CREATION" tarifId="1000" />
<frais id="1001" montant="50" typeTVA="S" typeFrais="RESILIATION" tarifId="1001" />
<frais id="1002" montant="50" typeTVA="S" typeFrais="RESILIATION" tarifId="1002" />

</dataset>